{
  "name": "payments_gateway",
  "kind": "service",
  "use_cases": ["internal-api", "connector"],
  "owner": "payments-platform",
  "runtime": {
    "supported": ["local-compose"],
    "admitted": []
  },
  "operational": {
    "class": "internal-service",
    "exposure": "internal"
  },
  "service": {
    "port": 8080
  },
  "image": {
    "repository": "payments-gateway",
    "package": "payments-gateway",
    "command": "python -m payments_gateway.main"
  },
  "metrics": {
    "format": "prometheus",
    "required_names": ["workload_info", "http_requests_total"]
  },
  "traces": {
    "supported": false
  },
  "database": {
    "semantics": "postgresql",
    "pooling": "direct"
  },
  "config": {
    "env": ["DATABASE_URL", "DB_HOST", "DB_PORT", "DB_USER", "DB_NAME"],
    "secrets": ["DB_PASSWORD"]
  }
}
