{
  "name": "identity_aware_partner_api",
  "kind": "service",
  "use_cases": ["internal-api", "connector"],
  "owner": "partner-platform",
  "runtime": {
    "supported": ["local-compose"],
    "admitted": []
  },
  "operational": {
    "class": "internal-service",
    "exposure": "internal"
  },
  "service": {
    "port": 8080
  },
  "image": {
    "repository": "identity-aware-partner-api",
    "package": "identity-aware-partner-api",
    "command": "python -m identity_aware_partner_api.main"
  },
  "metrics": {
    "format": "prometheus",
    "required_names": ["workload_info", "http_requests_total"]
  },
  "traces": {
    "supported": false
  },
  "database": {
    "semantics": "postgresql",
    "pooling": "direct"
  },
  "config": {
    "env": [
      "DATABASE_URL",
      "DB_HOST",
      "DB_PORT",
      "DB_USER",
      "DB_NAME",
      "IDENTITY_ISSUER",
      "PARTNER_DNS_ZONE"
    ],
    "secrets": ["DB_PASSWORD", "IDENTITY_CLIENT_SECRET"]
  },
  "bounded_dependencies": [
    {
      "name": "workforce_identity",
      "kind": "identity-provider",
      "purpose": "Authenticate inbound users through Entra ID at the platform edge.",
      "direction": "inbound",
      "owner": "identity-platform",
      "config": {
        "env": ["IDENTITY_ISSUER"],
        "secrets": ["IDENTITY_CLIENT_SECRET"]
      },
      "evidence": ["token validation smoke check"]
    },
    {
      "name": "partner_dns",
      "kind": "dns-provider",
      "purpose": "Publish the workload hostname through an external DNS provider.",
      "direction": "outbound",
      "owner": "network-platform",
      "config": {
        "env": ["PARTNER_DNS_ZONE"],
        "secrets": []
      },
      "evidence": ["delegation check"]
    }
  ]
}
